"ID";"Name";"LatinName";"Photo";"LandscapingZone";"ProsperityPeriod";"Description";"LocationPlace";"ViewForm";"global_id";
"111";"Колосняк гигантский";"Elymus giganteum";"649022aa-da85-467d-b0ca-f24b55fa2459";"Степь";"Июль";"Колосняк гигантский не выдерживает переувлажнения и растёт исключительно в сухих почвах. Его можно увидеть даже на песчаных дюнах Монголии. Ареал колосняка гиганстского охватывает черноземную полосу России, Украины и заходит в полупустыни Средней Азии. Кроме того, этот вид натурализовался в Северной Америке и в Новой Зеландии. Колосняк гигантский не такой огромный, как некоторые его родственники по семейству, его высота не превышает полутора метров, в то время как кукуруза может вырастать выше человека. Узнать этот вид можно по широким линейным листьям сочно-зелёного цвета.";"Степь";"Бесплатная";"881470930";
"112";"Ветреница лесная";"Anemone sylvestris";"ddb270de-1988-4afe-80e5-cf782f0e0e2d";"Степь";"Май - июнь
";"Ветреница лесная - один из самых поздно цветущих первоцветов. Она начинает цвести в мае, когда на деревьях распускаются листья. Ветреница лесная растёт во Франции, Германии, а затем её ареал протягивается на восток через всю умеренную зону России до северных окраин Китая. Этот вид очень поход на ветреницу дубравную: крупные белые цветки, немногочисленные сильно рассечённые листья. Только ветреница лесная отличается тем, что в её венчике лишь 5 более округлых лепестков зачастую с махровым краем, и цветёт она позже своих родственников.";"Степь";"Бесплатная";"881470946";
"113";"Полынь понтийская";"Arthemisia pontica";"3131a909-9872-464b-9b36-54c21ba36d19";"Степь";"Июль - август
";"Листья полыни понтийской содержат множество ароматических веществ, среди которых цинеол и камфора. Это растение используют в производстве вермутов для придания горчинки. Ареал полыни понтийской протягивается от атлантического побережья Европы до северных окраин Китая, захватывая степную зону Европейской России и южные районы Сибири. Этот вид полыни отличается более тонким стеблем, мягким опушением листьев с нижней стороны, придающим белёсый оттенок, и более узкими листьями в целом. Встречается полынь понтийская на не слишком тяжёлых и не слишком влажных в почвах, а порой растёт даже по обочинам дорогам.";"Степь";"Бесплатная";"881470950";
"114";"Василёк русский";"Centaurea ruthenica";"9471d1e8-efd8-409d-a72d-6ecf8405e172";"Степь";"Июль - август
";"Василёк русский - довольно редкий вид васильков, приуроченный к степям. Во многих субъектах Российской Федерации он занесён в Красные Книги. Василёк русский - один из типичных представителей степной зоны России. Его ареал протягивается по карте полумесяцем от Южной Европы через Кавказ и Южный Урал в страны Средней Азии. От других видов василька его легко отличить по соцветиям нежно-кремового цвета, распускающимся в июле. Встретить его можно на лугах, в кустарниковых зарослях и даже на крутых каменистых склонах.";"Степь";"Бесплатная";"881470952";
"115";"Мордовник обыкновенный";"Echinops ritro";"97e9eb20-377d-42df-88c5-3f54818d8f47";"Степь";"Июль - август
";"Листья, стебли и соцветия мордовника обыкновенного красивые и достаточно жёсткие. За эти качества растение используют во флористике как сухоцвет. Ареал мордовника обыкновенного тянется от атлантического побережья Евразии через страны Южной и Восточной Европы до тихоокеанского побережья в Китае, захватывая чернозёмную полосу России, Южный Урал и некоторые районы Сибири. От одуванчиков и цикориев, своих двоюродных братьев, мордовник отличается крупными рассечёнными листьями с острыми зубчиками по краю и ярко-синим шарообразным соцветием.";"Степь";"Бесплатная";"881470954";
"116";"Молочай кипарисовый";"Euphorbia cyparissias";"b03d8a4b-c4c2-4d19-bcc6-53e3f05bea63";"Степь";"Май - июнь
";"Молочай кипарисовый появился в Европе в бронзовом веке и активно распространился как заносный вид вслед за человеком. Исконно южно-европейское растение, молочай кипарисовый расселился в бронзовом веке по всей Европе, включая южные районы Европейской России. Его ареал лишь чуть-чуть заходит в Азию в районе Турции. От других видов его отличить легко по своеобразным побегам, которые внешне напоминают веточки сосны. В начале лета на вершине побегов созревает около 10 цветоносов длиной со спичку, на каждом из которых образуется маленький цветок, похожий на раскрывшуюся розу, диаметром с копеечную монету.";"Степь";"Бесплатная";"881470956";
"117";"Ирис безлистный";"Iris aphylla";"4eeb0df2-6778-46fb-85df-3cc0325e2ebe";"Степь";"Май - июнь";"Ирис безлистный чрезвычайно редкое растение и встретить его в природе большая удача. Растёт он в степях, что не очень свойственно ирисам. Ирис безлистный многолетнее травянистое растение с ползучим корневищем, достигающее в высоту 50 см. Стебли прямостоячие, выше основания разветвленные. Прикорневые листья линейно-мечевидные, широкие, стеблевые, немногочисленные, по мере приближения к цветку уменьшаются в размере. К зиме листья полностью опадают, поэтому вид был назван безлистным. Цветки крупные ярко-фиолетовые располагаются по 2 на длинных цветоносах. Произрастает по всей Европе от Атлантического побережья до Волги на востоке.";"Степь";"Бесплатная";"881470962";
"118";"Тонконог гребенчатый";"Koeleria cristata";"0bd6e0f7-b9d4-422a-9bd0-817fdc382c77";"Степь";"Май - июль
";"Тонконог крупноцветковый - устойчивое к стрижке и умеренным засухам растение. Его часто используют как покрытие площадок для гольфа. Тонконог крупноцветковый или тонконог монгольский - многолетнее травянистое растение образующее плотные дерновники. Стебли растения высотой 15-35 см опушенные под узлами. Пластинки листьев жесткие и свернутые с обоих сторон шероховатые, покрытые редкими волосками. Зеленоватые блестящие метелки состоят из многочисленных колосков 3-4 мм длиной. Растет на песчаных и пустынно-степных склонах, в степях и на сухих лугах.";"Степь";"Бесплатная";"881470964";
"119";"Лён многолетний";"Linum perenne";"55484b0d-6c40-418c-a367-03516e4617d2";"Степь";"Июнь - июль
";"Лён многолетний, в отличие от льна обыкновенного, не пригоден для производства ткани. Его часто используют как декоративное растение. Лен многолетний - сильноветвистое травянистое растение высотой до метра. Стебли тонкие, цветоносные, в верхней части обычно разветвленные, нижние ветви стерильные. Расположенные в очередном порядке тонкие листья напоминают иглы. У льна многолетнего маленькие, до 2 см, бледно-голубые цветки. Он очень схож с льном австрийским, что иной раз затрудняет их систематизацию. Встречается в степной зоне, на луговых склонах, горных лугах, часто на выходах известняка на юге европейской части России, Средней Азии и в Сибири, что отличает его от льна австрийского, не заходящего далеко на север.";"Степь";"Бесплатная";"881470968";
"120";"Шалфей дубравный";"Salvia nemorosa";"9f86b68d-e560-471f-ba7f-7012c5a3a480";"Степь";"Июнь - август";"Шалфей дубравный издревле считается ценным медоносом. Шалфейный мёд применяют не только в пищу, но и широко используют в медицине. Шалфей дубравный он же сальвия дубравная - многолетний травянистый кустарник, достигающий в высоту до метра. Четырехгранные прямые стебли покрыты узкоовальными темно-зелеными листьями. Некрупные приятно пахнущие фиолетовые цветки на коротких опушенных цветоножках собраны в простые соцветия. Произрастает в Средней Европе, в предгорьях Крыма и на европейской части России. Предпочитает степи и степные склоны, сухие луга и лесные опушки.";"Степь";"Бесплатная";"881471964";
"121";"Ковыль волосовидный";"Stipa capillata";"7c6ffb94-fad5-41ef-87d3-76084662a685";"Степь";"Май - июнь
";"Семена ковыля волосовидного снабжены длинной остью, которая при увеличении влажности раскручивается и будто вбуравливает семя в почву. Ковыль волосовидный - многолетний травянистый злак в высоту достигающий 30-70 см. Крепкие голые стебли окружены щитовидно вдоль сложенными листьями. В период цветения на каждом колоске появляются седые нити длиной около 25 см, напоминающие конский волос. Во время сильного ветра на поле из ковыля создается ощущение, что по нему бегут зелено-серебристые волны. Ковыль предпочитает расти в луговых и нагорных степях и лесостепях европейской части России, в Закавказье и Западной Сибири.";"Степь";"Бесплатная";"881471971";
"122";"Коровяк фиолетовый";"Verbascum phoenicum";"65431742-8033-423e-8d7a-14fcf86f48c2";"Степь";"Июнь - июль
";"В природе коровяк фиолетовый - многолетнее растение, но в условиях Москвы двулетнее. На первом году жизни оно даёт розетку листьев, а на втором - зацветает и плодоносит. Коровяк фиолетовый - многолетнее травянистое растение с прямостоячим стеблем высотой до метра, нижняя часть которого покрыта желёзистыми волосками. Прикорневые листья, которые ботаники называют розеточными, густо опушены с обеих сторон. Одиночные цветки расположены на длинных цветоножках, собраны в кистевидное соцветие. Ареал коровяка фиолетового тянется из Средней Европы через всю Россию до западных окраин Китая. Встречается в долинах рек, сухих лугах и степях.";"Степь";"Бесплатная";"881471990";
"123";"Вероника колосистая";"Veronica spicata";"a8f773d0-1954-4404-a291-bd3c4e6879fe";"Степь";"Июнь - июль";"Вероника колосистая известна в культуре с 1570 года, а впервые описали этот вид больше чем 180 лет спустя, в 1753 году. Вероника колосистая - травянистое многолетнее растение высотой от 10 см до метра. Её прямые, обычно одиночные стебли покрыты маленькими волосками. Очередные ланцетные листья на небольших черешках расположены на стебли поочерёдно. Цветки собраны в густую кисть длиной до 30 см на верхушке стебля. Их цвет колеблется от бледно-розового до фиолетового. Вероника колосистая предпочитает расти на лесных лужайках, в степях, на склонах гор. В России встречается почти повсеместно в степной зоне и в горах до субальпийского пояса.";"Степь";"Бесплатная";"881472156";
"124";"Катран сердцелистный";"Crambe cordifolia";"7020d718-c10f-4a47-aa98-94c95ff05745";"Степь";"Июнь";"Молодые листья катрана сердцелистного имеют приятный капустный запах. Иногда их добавляют в салаты. Катран сердцелистный - травянистый многолетник высотой с человеческий рост и с длинным стержневым корнем. Голые сильноветвистые стебли покрыты большими сердцевидными листьями, которые становятся фиолетовыми при распускании. Многочисленные белые цветки пахнут резко и образуют метёлковидное соцветие. Родина растения - Кавказ. На территории России встречается в предгорьях Кавказа, также произрастает в бассейне Средиземного моря. Растет в степях и на каменистых почвах.";"Степь";"Бесплатная";"881472192";
"125";"Катран татарский";"Crambe tatarica";"f415a002-90ff-45fe-b59a-8bc13f120a20";"Степь";"Май - июнь";"Когда семена катрана татарского созревают, его цветонос засыхает, отрывается от корневища и катится по степи, раскрывая по пути плоды. Катран татарский - многолетний сизо-зеленый корневищный кустарник высотой до полутора метра. Стебель сильноветвящийся, во время плодоношения превращается в «перекати-поле» и таким образом распространяет семена на дальние расстояния. Прикорневые листья ланцетные перисто-раздельные на небольших черешках. Многочисленные белые цветки образуют сложную кисть. На территории России встречается в европейской части, в Западной Сибири и предгорьях Кавказа. Предпочитает степи и лесостепи.";"Степь";"Бесплатная";"881472196";
"126";"Синеголовник плосколистный";"Eryngium planum";"b0a1d4cc-5ba6-40d6-83f7-1ce0f4e09695";"Степь";"Июнь - август";"Побеги синеголовника плоского часто используют в сухих композициях, а фенольные соединения, испаряющиеся при сушке, убивают болезнетворные микроорганизмы в воздухе. Синеголовник плоский - многолетник со стрежневым корнем и прямостоячим стеблем высотой до метра. Все части растения имеют голубой или фиолетовый оттенок, особенно ярко выраженный на соцветиях. Стебли синеголовника покрыты жесткими кожистыми листьями коротких черешках. Голубые или синие цветки собраны в плотные головчатые соцветия. Растет на сухих лугах, лесных опушках, по берегам рек, предпочитает сухие и солнечные места. Произрастает в европейской части России, на юге Западной Сибири и на Северном Кавказе.";"Степь";"Бесплатная";"881472233";
"127";"Качим метельчатый";"Gypsophyla paniculata";"6c7d79ab-b5d9-4b15-ae34-ea2e4e8aa016";"Степь";"Июнь - июль
";"Качим метельчатый способен расти на песках, поэтому его насаждения используют для защиты почв от выветривания. Качим метельчатый - многолетнее травянистое растение высотой до метра с длинным корнем и раскидистым широким стеблем. Сильноветвящиеся стебли образуют кусты шаровидной формы. После «куст» отрывается от корня и начинает существовать в форме перекати-поля. Его вытянутые остроконечные листья покрыты восковым налетом. Многочисленные розовые или белые образуют раскидистое соцветие-метелку. Ареал качима охватывает степную зону Европейской части России и заходит на юг Западной Сибири.";"Степь";"Бесплатная";"881472328";
"128";"Пион тонколистный";"Paeonia tenuifolia";"9f213ef1-6091-4905-9281-d4c29605d85c";"Степь";"Май
";"Дикий пион узколистный в России можно встретить лишь в Крыму или на Кавказе. Культурные сорта более морозоустойчивы, их можно увидеть значительно севернее. Пион узколистный - красивоцветущее многолетнее растение, вырастающее до полуметра в высоту. Изящный стебель с одиночным цветком на вершине покрыт рассеченными на мелкие доли ажурными листьями. Темно-пурпурные или ярко-красные цветы шаровидной формы диаметром до 8 см состоят из 8-10 лепестков. В природе пион узколистный встречается в лесостепной и степной зоне. Растёт на территории Восточной Европы, на Балканском полуострове, на Кавказе и в Крыму.";"Степь";"Бесплатная";"881472397";
"130";"Ломонос цельнолистный";"Clematis integrifolia";"12a5cfd2-d219-46d0-8a75-17f0cb1f2be7";"Степь";"Июнь - июль";"Название «ломонос» возникло из-за резкого запаха растения, способного вызывать насморк. Ломонос цельнолистный -многолетний полукустарник высотой около полуметра. Его прямостоячие стебли покрыты мелкими белыми волосками. Листья ланцетные с резко выступающими жилками. Тёмно-фиолетовые или чёрно-пурпурные цветки большей частью одиночные и расположены на верхушке стебля или боковых ветвей. Растет в степях, на лесных опушках, в долинах горных рек и в зарослях кустарников. В России встречается на Северном Кавказе и Алтае.";"Степь";"Бесплатная";"881472430";
"131";"Тюльпан Биберштейна";"Tulipa biebersteiniana";"f674b90a-4072-422e-8462-8d776acce3d3";"Степь";"Апрель - май
";"Тюльпан Биберштейна обычно встречается в степях. В Московской области он растёт в единственном месте на территории Приокско-террасного заповедника. Тюльпан Биберштейна - многолетнее луковичное растение, многократно цветущее и плодоносящее в течение жизни. На стебле высотой около 25 см обычно располагаются 2-3 узких листа, напоминающих желобок. Цветок обычно одиночный, в солнечную погоду широко раскрытый, золотисто-желтые листочки околоцветника заостренной формы. Предпочитает расти в степной зоне, на лесных опушках и в кустарниковых зарослях. Произрастает в Восточной и Юго-Восточной Европе, Северной Азии, на Кавказе и в Западной Сибири.";"Степь";"Бесплатная";"881472447";
