"ID";"Name";"LatinName";"Photo";"LandscapingZone";"ProsperityPeriod";"Description";"LocationPlace";"ViewForm";"global_id";
"91";"Василёк фригийский";"Centaurea phrygia";"a5b8179a-7cfa-4f02-bd57-8e035694fb4f";"Луг";"Июль - август";"Василёк фригийский очень нетребователен к условиям: он может расти как на глинистых, так и на песчаных почвах. Также он выдерживает морозы до -25 градусов Цельсия. Имя васильку фригийскому дал ещё Карл Линней по месту сбору образца, который он описывал. Однако этот вид растёт и далеко за пределами Фригии (современной Турции), в странах Южной и Восточной Европы, а также в средней полосе России. От родственников василёк фригийский отличается тем, что верхняя часть его побегов ветвится, и верхушке каждого ответвления распускается яркое розово-фиолетовое соцветия, похожее корзинку василька лугового.";"Луг";"Бесплатная";"881470764";
"92";"Василёк шероховатый";"Centaurea scabiosa";"e32d9a7f-4820-4c18-ab3f-3f80b606073a";"Луг";"Июль - август";"Василёк шероховатый выращивают не только в декоративных целях, но и подсевают его на пашни и сенокосные луга. Василёк шероховатый встречается по всё умеренной зоне Евразии от атлантического до тихоокеанского побережья, однако на Дальнем Востоке считается видом заносным. Отличить его от других видов васильков очень просто по листьям: если у его родственников листья цельные, то у василька шероховатые - рассечённые на множество ланцетовидных долей. А цветки почти такие же как у василька лугового: розово-фиолетовые, собранные в соцветия-корзинки.";"Луг";"Бесплатная";"881470767";
"93";"Цикорий обыкновенный";"Cichorium intybus";"5445df10-0903-49f1-92ec-d33afd748cbe";"Луг";"Июль - октябрь";"Корни и листья цикория обыкновенного содержат до 11 процентов инулина, поэтому его часто используют как суррогат кофе. Ареал цикория обыкновенного сейчас охватывает все континенты, кроме Антаркдиты. Исходно этот вид был европейским, а по всему миру расселился вместе с человеком. Узнать цикорий можно по разветвлённым плотным побегам, на которых созревают по нескольку соцветий-корзинок. Их цвет варьирует от всех оттенков голубого до белого и розового. Встретить цикорий обыкновенный можно на лугах, опушках, обочинах дорог и пустырях.";"Луг";"Бесплатная";"881470773";
"94";"Вероника длиннолистная";"Veronica longifolia";"0d63b34b-0a83-489c-a909-a8b146775241";"Луг";"Июнь - сентябрь
";"В побегах и корневищах вероники длиннолистной содержатся вещества-иридоиды, поэтому её надземные части заготавливают как лекарственное сырьё. От своих родственников вероника длиннолистной отличается листьями, похожими на вытянутый равнобедренный треугольник, и длинными свечкообразными соцветиями - полностью оправдывает своё название. Ареал вероники длиннолистной большую часть Евразии, за исключением тропических и арктических областей. Она тяготеет к влажным местообитанием и в средней полосе России встречается на пойменных лугах. Узнать это растение можно по треугольным листьям и вытянутым коническим соцветиям, похожим на свечки. В природе цветки вероники длиннолистной обычно синего цвета, однако в культуре существуют формы с крайне разнообразной окраской: от белого до розового и тёмно-фиолетового.";"Луг";"Бесплатная";"881470801";
"95";"Герань луговая";"Geranium pratense";"197fe7d4-fe0f-476f-a3c3-c9198e12d04d";"Луг";"Июнь - июль";"Зрелые плоды герани луговой напоминают голову журавля с длинным клювом, из-за чего это растение часто называют в народе журавельником. Ареал герани луговой тянется через всю умеренную зону Евразии: от Испании до Китая, покрывая большую часть территории России. В средней полосе она встречается на лугах, по опушкам лесов, а также зачастую и в городах по пустырям. От своих родственников герань луговая отличается глубоко рассечёнными прикорневыми листьями, доли которых выглядят заострёнными по сравнению с другими видами.";"Луг";"Бесплатная";"881470812";
"96";"Будра плющелистная";"Glechoma hederacea";"eba76e91-8ded-441c-a328-d3d3703ad08f";"Луг";"Июнь - июль
";"В тенистых условиях будра плющевидная ведёт себя как виолент: разрастается и агрессивно вытесняет с территории другие растения. Ареал будры плющевидной охватывает почти всю внетропическую Евразию от её атлантического до тихоокеанского побережья. В России это растение широко известно как собачья мята и растёт обычно в тенистых лесах. У будры плющевидной есть два типа побегов: длинные стелющиеся, которые укореняются в почве, и восходящие, на которых созревают цветки. Узнать этот вид можно по небольшим округлым листочкам с округлым краем.";"Луг";"Бесплатная";"881470816";
"97";"Зверобой продырявленный";"Hypericum maculatum";"5b8813c8-94d8-480f-8508-f1685f996ab1";"Луг";"Июнь - август
";"Экстракт зверобоя продырявленного был одним из основных компонентов в классическом рецепте напитка «Байкал». Зверобой продырявленный встречается в Северной Африке и по всей умеренной полосе Евразии, за исключением некоторых районов Сибири и Дальнего Востока. В средней полосе России растёт по лугам и опушкам, порой даже образует сплошные заросли. Этот вид легко узнать по желтым соцветиям на верхушках жёстких побегов. Стебель обычно с чётко выраженными гранями, листья округлые, растут парами друг напротив друга, с мелкими просвечивающими точками - отсюда и название вида.";"Луг";"Бесплатная";"881470830";
"98";"Нивяник обыкновенный";"Leucanthemum vulgare";"4fadc78f-92e3-41e4-bf77-a95db88f8334";"Луг";"Май - август
";"Нивяник обыкновенный часто ошибочно называют ромашкой. Листья нивяника шириной около 1 см, зубчатые по краю, а у ромашки похожи на укроп. Нивяник обыкновенный часто путают с ромашкой, хотя эти виды легко отличить друг от друга. У нивяника листья элиптические с зубчатым краем, а у ромашки сильно рассечённые, похожие на укроп. Ареал нивяника охватывает всю умеренную зону Евразии, а благодаря человеку этот вид заселился на все материки, кроме Антарктиды. В средней полосе России его можно встретить на лугах, заброшенных полях и пастбищах и по опушкам лесов.";"Луг";"Бесплатная";"881470832";
"99";"Молиния голубая";"Molinia cearulea";"d7851765-f3f9-4380-842d-4ab3cff9af60";"Луг";"Июль - август
";"Корневища молинии голубой обладают высокой устойчивостью к огню, поэтому растение с лёгкостью возобновляется после палов травы. Молиния синяя - двоюродная сестра пшеницы и овса, все эти растения относятся к семейству злаковых. В природе молиния встречается в Северной Африке, Западной Азии и по всей Европе. От родственников её отличает соцветие в виде метёлки из мелких густых колосьев, которые порой отливают синим оттенком. Длинные узкие и жёсткие листья в месте крепления к стеблю образуют кольцо из мелких волосков.";"Луг";"Бесплатная";"881470838";
"100";"Донник белый";"Melilotus albus";"f0d01302-183a-4919-8f83-7b9b7d3b6e6c";"Луг";"Июль - октябрь";"Донник белый образует симбиоз с клубеньковыми бактериями, способными фиксировать азот из воздуха. Для улучшения свойств почв это растение используют в севообороте. Донник белый распространён в умеренной зоне Евразии, а XVII веке попал с колонистами в Северную Америку, где также успешно расселился. В средней полосе России этот вид встречается на лугах и опушках. Выглядит донник белый точь-в-точь как его родственник донник лекарственный: сильно разветвлённые побеги высотой около метра с тройчатыми вытянутыми листьями, отличаются лишь цветками. У донника белого они имеют кремовую или белую окраску.";"Луг";"Бесплатная";"881470847";
"101";"Донник лекарственный";"Melilotus officinalis";"8483008b-c65b-488d-b47e-b773c463de73";"Луг";"Июнь - сентябрь
";"Донник лекарственный - очень ценное растение-медонос. С одного гектара посадок донника пчёлы собирают до 600 кг нектара. Донник лекарственный исходно был европейским видом, однако вместе с человеком расселился по всем континентам, кроме Антарктиды. В средней полосе России встречается повсеместно на лугах, опушках, пустырях и в городах. Порой образует сплошные заросли. По внешнему виду схож с донником белым: сильно разветвлённые побеги с небольшими тройчатыми листьями. Его отличительная черта - жёлтый цветки, собранные на верхушках побегов в кистевидные соцветия.";"Луг";"Бесплатная";"881470849";
"102";"Лапчатка серебристая";"Potentilla argentea";"7dc153c9-d39b-4f7e-aae8-47c596ca5c0a";"Луг";"Май - сентябрь";"Цветки лапчатки серебристой весьма компактные. И их основные опылители отнюдь не шмели и пчёлы, а жуки, мухи и некоторые виды комаров. Исходный ареал лапчатки серебристой охватывает всю умеренную зону Евразии. В средней полосе России она растёт на лугах, опушках, пастбищах, по насыпям железных дорог и пустырям. Несмотря на неприхотливость, этот вид очень декоративен: на небольших нежных стеблях (высотой до 30 см) сидят небольшие жёлтые цветки, похожие на лютики, хотя эти растение даже из разных семейств. Отличительная особенность этого вида - опушение на нижней стороне листа, придающее серебристую окраску.";"Луг";"Бесплатная";"881470852";
"103";"Черноголовка обыкновенная";"Prunella vulgaris.";"44b98c09-c560-4f6e-813f-0a35c943a9c6";"Луг";"Июнь - октябрь
";"Черноголовка обыкновенная растёт не только в парках Москвы, но также встречается на влажных лугах всех материков, кроме Антарктиды (там и лугов нет). Ареал черноголовки обыкновенной охватывает вне тропические регионы северного полушария: от Северной Африки через всю Евразию до Северной Америки. В средней полосе России этот вид встречается по лугам, опушкам, вырубкам, а порой в парках и на неухоженных газонах. От других растений черноголовка обыкновенная отличается вытянутыми листьями, которые сужаются к кончику и сидят друг напротив друга, а также головчатым соцветием из небольших фиолетовых цветков на верхушке.";"Луг";"Бесплатная";"881470866";
"104";"Мыльнянка лекарственная";"Saponaria officinalis";"82eae121-fa6c-4d4c-a60a-24bb32b2e18c";"Луг";"Апрель - август
";"Подземные части мыльнянки обыкновенной широко известны как мыльный корень. Они содержат много сапонинов, из-за чего пенятся в воде. Ареал мыльнянки обыкновенной тянется из Центральной Европы в Среднюю Азию, покрывая большую часть Европейской России и юг Западной Сибири. В средней полосе это растение можно часто встретить на сырых лугах или по берегам рек, а порой и на заброшенных дачах и даже в городах. По внешнему виду мыльнянка похожа на свою двоюродную сестру гвоздику. Только цветки мыльнянки собраны в метёльчатые соцветия и обычно имеют светло-розовую окраску, а листья более широкие.";"Луг";"Бесплатная";"881470868";
"105";"Крестовник Якоба";"Senecio jacobaea";"eb6d1827-08ab-4b7c-a7e7-fe6a15a625d1";"Луг";"Июль - август";"Крестовник Якоба культивируется очень редко, обычно лишь при воссоздании природных ландшафтов, поэтому культурных сортов и гибридов не имеет. Крестовник Якоба растёт по всей умеренной зоне Евразии, начиная от Британских островов и заканчивая Дальним Востоком и Китаем. Как заносное это растение встречается также в Австралии и Северной Америке. Крестовник Якоба выглядит похожим на свою двоюродную сестру пижму: побеги высотой по пояс, в верхней части сильно ветвятся, на верхушке каждого ответвления созревает небольшое соцветие-корзинка. Только у крестовника порой в соцветиях развиты длинные жёлтые язычковые цветки.";"Луг";"Бесплатная";"881470872";
"106";"Пижма обыкновенная";"Tanacetum vulgare";"ee34163a-48b3-492a-b809-bdf8a5341921";"Луг";"Июль - сентябрь
";"В старину цветоносы пижмы обыкновенной сушили и развешивали в домах. Это растение отпугивает различных насекомых своим запахом. Пижма обыкновенная относится к семейству сложноцветных, но в отличии от большинства родственников в её соцветиях-корзинках нет язычковых цветков, привлекающих насекомых. Узнать этот вид можно также по сложным листьям с многочисленными пильчатыми листочками. Ареал пижмы обыкновенной охватывает всю умеренную зону Евразии. В средней полосе России встречается повсеместно: на лугах, опушках, заброшенных полях, пустырях и неухоженных газонах.";"Луг";"Бесплатная";"881470878";
"107";"Вейник остроцветковый";"Calamagrostis x acutiflora";"ee9b7f97-72bf-4a77-8f4d-3a3e16c62e49";"Луг";"Июнь - июль
";"Вейник остроцветковый - очень популярный в озеленении гибрид двух природных видов вейника. Он растёт компактно и не даёт расползающихся корневищ. Вейник остроцветковый образовался в природе путём гибридизации двух естественных видов вейника: тростниковидного и наземного. Оба природных вида и их гибрид растут в лесах, на опушках и по окраинам болот в умеренной зоне Евразии. Вейник остроцветковый приходится двоюродным братом ржи и пшенице - все эти растения относят к семейству злаковых. Вейник можно узнать по относительно широким глянцевым листьям и цветоносом, высотой с человеческий рост, на верхушках которых образуется метёлковидное соцветие из мелких бежевых колосков.";"Луг";"Бесплатная";"881470893";
"108";"Клевер ползучий";"Trifolium repens";"0b75fe94-66a9-48c4-bbe1-ae9f3fd6f5a7";"Луг";"Июнь - июль";"У клевера ползучего есть два типа побегов: стелющиеся, из-за которого растение получило своё название, и прямостоячие, несущие цветки. Клевер ползучий был исходно европейским видом, но в настоящее время натурализовался на всех континентах, кроме Антарктиды. Крайне неприхотливое и выносливое растение, которое можно встретить почти на каждом газоне. Отличить его можно по округлым тройчатым листья, диаметром с 50-копеечную монету, и небольшим шарообразным соцветиям-головкам, в которые собраны вытянутые белые цветки.";"Луг";"Бесплатная";"881470904";
"109";"Клевер луговой";"Trifolium pratense";"230cc09a-769f-442a-8c9d-0e7f197371cb";"Луг";"Июнь - июль";"Нектар из цветков клевера лугового доступен лишь крупным насекомым с длинным хоботком. Под такие параметры попадают пчёлы и шмели. Ареал клевера лугового охватывает всю Евразию от Португалии до Дальнего Востока и заходит в Северную Африку. В России встречается повсеместно на лугах, опушках, вырубках, пустырях, заброшенных полях и по обочинам дорог. От других видов клевер луговой отличается относительно невысокими побегами (около 30 см) и слегка вытянутыми эллиптическими листьями с ярко выраженной светлой «галочкой» в центре листовой пластинки.";"Луг";"Бесплатная";"881470906";
"110";"Гусиный лук жёлтый";"Gagea lutea";"3248c604-360e-4277-9394-09c1755b092d";"Луг";"Июнь";"Листья гусиного лука жёлтого обладают резким запахом из-за чесночных эфирных масел. Иногда их для пикантности добавляют в салаты. Гусиный лук жёлтый - приметное раннее весеннее растение с красивыми жёлтыми цветками. В апреле-мае его листья легко отличаются от других трав ярко-зелёной окраской. Среди узких длинных листьев в середине апреля можно найти тонкие цветоносы с яркими жёлтыми шестилепестными цветками. Встретить это растение можно на лугах, опушках, по вырубкам, а порой и в городских парках. В природе распространено по всей Европе, в Сибири и на Дальнем Востоке.";"Луг";"Бесплатная";"881470912";
