"ID";"Name";"LatinName";"Photo";"LandscapingZone";"ProsperityPeriod";"Description";"LocationPlace";"ViewForm";"global_id";
"50";"Очиток ложный";"Sedum spurium";"dd9aeae8-6e35-4833-8b29-8f8e7780db19";"Северный ландшафт";"Июнь - июль";"Очиток ложный - эндемик Кавказа, однако из-за широкого распространения в культуре его можно встретить во многих регионах как заносный вид. Очиток ложный встречается исключительно на Кавказе и на прилегающих к нему территориях, из-за чего растение считается кавказским эндемиком. От своих родственников, которых можно встретить в парке, очиток ложный отличается нежно-розовыми цветками и почти стелющимися короткими стеблями. В природе этот вид встречается на скалах и каменистых осыпях, но широко распространён и в культуре.";"Северный ландшафт";"Бесплатная";"881465910";
"51";"Живучка ползучая";"Ajuga reptans";"00b65109-c60d-4a41-a6ec-5e4c709be87d";"Хвойный лес";"Апрель - июнь
";"Живучка ползучая - типичный обитатель лесов Европы, в том числе и российских. Порой этот вид «выходит» из лесов на опушки и луга. Живучка ползучая образует два типа побегов: первые, ползучие, стелются по почве и укореняются, а другие растут вертикально, именно на них и образуются соцветия из небольших синих цветков, похожие на свечки. Хотя цветки и содержат нектар, опылители посещают лишь при отсутствии других медоносов поблизости. Благодаря наличию двух типов побегов, живучка растёт небольшими полянками, которая является клоном проросшей когда-то из семени особи.";"Хвойный лес";"Бесплатная";"881466173";
"52";"Копытень европейский";"Asarum europeum";"b20acbb9-8d7f-4bab-af1b-417fd6198da6";"Хвойный лес";"Апрель - май
";"Копытень европейский выбрал необычный способ опыления и распространения семян: для этих целей он привлекает муравьёв. Копытень европейский - редкий представитель тропического семейства Кирказоновых во флоре умеренной полосы. Однако он широко распространён в тенистых лесах Европы и Западной Сибири. Узнать копытень довольно просто по тёмно-зеленым листьям, похожим по форме на след лошади, - отсюда и русское название вида. А вот увидеть цветки этого растения уже не так просто: они невзрачные и растут на уровне почвы. Так растение приспособилось под опыление с помощью муравьёв.";"Хвойный лес";"Бесплатная";"881466212";
"49";"Очиток гибридный";"Sedum hybridum";"fa2b9f29-9c42-455c-903a-79ff8ddea752";"Северный ландшафт";"Июнь - июль";"Форма побегов очитка гибридного зависит от условий освещения: в тени он образует более разреженные прямостоячие побеги, а на свету растёт компактно. Очиток гибридный встречается в природе лишь на Алтае и в горах Средней Азии, где растёт по сухим каменистым склонам и осыпям. От двух других видов очитка, которые растут в парке, очиток гибридный отличается относительно крупными (до 2.5 см в длину) листьями яйцевидной формы с драным краем. Причем обычно листья растут парами друг напротив друга и каждая следующая пара расположена перпендикулярно предыдущей. С мая по август очиток гибридный цветёт небольшими жёлтыми цветками.";"Северный ландшафт";"Бесплатная";"881466246";
"53";"Ожика волосистая";"Lusula pilosa";"66f17061-e775-4f72-8d51-c62494fc77e5";"Хвойный лес";"Апрель - июнь";"Ожика волосистая - абориген наших лесов. Это растение привыкло жить на небогатых почвах в затенении, но при этом выглядит очень декоративно. Сначала может показаться, что ожика волосистая выглядит совсем как обыкновенные злаки и осоки, но это не совсем так. В апреле, когда ожика начинает цвести, её легко отличить по светлым метёлковидным соцветиям с обилием небольших белых цветков, которые к июню превращаются в мелкие шарообразные плодики. Такие плоды и цветки бывают только у представителей семейства ситниковых. Растёт этот вид в лесах по всей умеренной зоне Евразии и Северной Америки.";"Хвойный лес";"Бесплатная";"881466311";
"54";"Майник двулистный";"Majanthemum bifolium";"c3577a82-6dba-434f-bdd2-c5f899c620cd";"Хвойный лес";"Май - июнь";"В названии майника двулистного закодированы все основные черты растения: цветёт оно в мае, а после цветения от него остаются лишь два листа. Цветки у этого вида мелкие, собранные в грацильное кистевидное соцветие на верхушке побега. Листья растут всегда парами, тоже нежные, светло-зелёные, по форме похожи на ландыш, только значительно меньше в размерах. Растёт это хрупкое растеньице в темнохвойных и смешанных лесах от Британских островов до Дальнего Востока.";"Хвойный лес";"Бесплатная";"881466328";
"55";"Голокучник обыкновенный";"Gymnocarpium dryopteris";"02e2c3a4-1d33-4643-92e5-c8befb4a916f";"Хвойный лес";"Не цветет";"Голокучник обыкновенныйя может размножатся как спорами, так и с помощью длинных и тонких корневищ, расползающихся на несколько метров от материнского растения. Очень распространённый папоротник, предпочитающий расти в тенистых лесах умеренной зоны Евразии и Северной Америки. Под лесным пологом вайи голокучника вырастают не выше 30 см, а в просветах или на вырубках он может достигать полуметра в высоту. Отличить этот папоротник от родственников можно по листьям, чей контур похож на равносторонний треугольник.";"Хвойный лес";"Бесплатная";"881466508";
"56";"Щитовник расширенный";"Dryopteris dilatana";"9526e660-9266-4615-b689-a75835c8eda0";"Хвойный лес";"Не цветет
";"Щитовник расширенный родом из горных лесов Кавказа, Алтая и Дальнего Востока, где растёт на скалах, близ ручьёв. Щитовник расширенный растёт в Центральной и Южной Европе, а также в горных лесах Кавказа, Алтая, на Дальнем Востоке и в Северной Америке. В средней полосе России этот вид папоротников не встречается в природе. Он предпочитает богатые и влажные почвы, где может разрастаться до полутора метров в высоту. От наших местных видов щитовник расширенный отличается размером и «раскидитостью» листьев.";"Хвойный лес";"Бесплатная";"881466526";
"57";"Кошачья лапка двудомная";"Antennaria dioica";"8fa332cc-fcef-461a-9830-1e212693d729";"Хвойный лес";"Май - июль";"Розетки её листьев напоминают по контуру и на ощупь подушечки пальцев кошек - отсюда происходит и русское название растения. Растёт по всей Евразии, кроме тропических регионов, однако наиболее обильно она встречается в тундрах и высокогорьях. В средней полосе России её можно увидеть на бедных и сухих почвах. Такие условия бывают, например, в сосняках на песках. Узнать кошачью лапку довольно просто: её сплошь покрытые войлочным опушением листья выглядят белесо-сероватыми и образуют небольшие розетки. Из розеток в мае-июне выходит цветонос с несколькими соцветиями-корзинками на верхушке.";"Хвойный лес";"Бесплатная";"881466549";
"58";"Колокольчик персиколистный";"Campanula persicifolia";"172b188e-4679-48d3-ad54-717a7d262b86";"Хвойный лес";"Июнь - июль";"Колокольчик персиколистный - самый русский из всех колокольчиков: большая часть его ареала расположена в России. Ареал колокольчика персиколистного приходится на Восточную Европу, а наиболее обильно он растёт в Европейской части России. Встретить его можно на лугах, по опушкам или в светлых лесах. Отличить этот вид от других местных колокольчиков можно по цветкам, которые растут по 3-5 штук ближе к верхушке цветоноса. Их лепестки рассечены примерно на треть, а далее срастаются, образуя узнаваемый «колокол».";"Хвойный лес";"Бесплатная";"881466569";
"59";"Ландыш майский";"Convallaria majalis";"6d0f273f-67ac-443b-ade8-3064d6a183ef";"Хвойный лес";"Май - июнь";"Ландыш майский - очень красивое и уязвимое растение. Оно сильно страдает из-за вытаптывания в парках и лесах близ городов. Ареал ландыша майского охватывают всю умеренную зону Евразии и Северной Америки: его можно встретить в лиственных или сосновых лесах от Британии до Китая и США. Наверное, внешний вид ландыша не нуждается в подробном описании, но отметим некоторые особенности его размножения. Он способен очень быстро разрастаться с помощью длинного корневища, и клоны одной особи могут занять целую поляну.";"Хвойный лес";"Бесплатная";"881466617";
"60";"Гвоздика-травянка";"Dianthus deltoides";"946e9b41-f4b1-4a81-8fc4-b506f63b745d";"Хвойный лес";"Июнь - июль";"Гвоздика травянка заслужила своё русское родовое название из-за похожести семян на ржавые гвозди. Гвоздика-травянка широко распространённый евразийский вид, который можно встретить от атлантического побережья Европы до Байкала. Растёт этот вид преимущественно на лугах и заброшенных полях. Узнать его можно по красным цветкам, диаметром с пятирублёвую монету, лепестки которых заканчиваются несколькими зубчиками. Листья всегда расположены парами напротив друг друга, внизу побега они слегка округлой формы, а ближе к верху - заострённые.";"Хвойный лес";"Бесплатная";"881466647";
"61";"Перловник поникающий";"Melica nutans";"52f1520d-57fc-4da0-aeeb-7edf0e159cae";"Хвойный лес";"Май - июнь";"Название перловника поникшего происходит от слова «перло», переводящееся как жемчужина, бусина. От этого слова происходит и название перловой каши, но делают её из ячменя. Ареал перловника поникшего охватывает умеренную зону Евразии. Его можно встретить в тенистых широколиственных или сосновых лесах по все Европе, обычен для средней полосы России. От других злаков перловник хорошо отличается по соцветию: обычно все колоски в нём склоняются на одну сторону. Колос от этого поникает, отсюда происходит русское название растения.";"Хвойный лес";"Бесплатная";"881468491";
"62";"Вероника седая";"Verinica incana";"a4724929-c49b-402a-96ff-5d40031df939";"Хвойный лес";"Июнь - сентябрь";"Веронику седую можно встретить на лугах и в лесах на сухих почвах. От своих родственников она отличается серебристой окраской листьев. Ареал вероники седой охватывает большую часть умеренной зоны Евразии: она встречается, начиная с Сербии и заканчивая Дальним Востоком. Это растение имеет весьма примечательную внешность, поэтому узнать его довольно просто. Листья вероники седой серебристого цвета и бархатистые на ощупь. Летом на верхушке побега образуется похожее на свечку соцветие из ярко-фиолетовых или тёмно-синих цветов.";"Хвойный лес";"Бесплатная";"881468508";
"63";"Прострел раскрытый";"Pulsatilla patens";"8e70e6c0-44f5-4d00-a5a5-dcfade1bbcac";"Хвойный лес";"Апрель - май";"Прострел раскрытый - очень редкое растение, оно внесено в Красные книги многих субъектов РФ. Кроме того, прострел необычайно красив как в период цветения, так в плодах. Несмотря на то, что ареал прострела раскрытого охватывает огромные территории, начиная с Румынии и заканчивая Дальним Востоком, США и Канадой, встречается в природе он нечасто. Но если вам посчастливилось наткнуться на это растение, то опознать его предельно просто. Его побеги и сильно рассечённые листья густо опушены, а в апреле-мае он выпускает цветонос с крупным сине-фиолетовым цветком на верхушке.";"Хвойный лес";"Бесплатная";"881468513";
"64";"Волжанка обыкновенная";"Aruncus vulgaris";"70caa502-f39a-4462-ac50-ce8280524b99";"Смешанный лес";"Июнь - июль";"Волжанка обыкновенная - одно из самых крупных европейских травянистых растений. Её высота может превышать человеческий рост, однако стебли не одревесневают. Ареал волжанки обыкновенной покрывает лишь Центральную Европу, захватывая западные окраины России и Кавказ. Встретить это растение можно на богатых почвах в широколиственных лесах или вдоль горных рек. В благоприятных условиях может вырастать высотой с человеческий рост и образовывать раскидистые кусты. Листья волжанки похожи на ежевику, а в июне-июле на верхушках её побегов образуются метёлковидные белые соцветия.";"Смешанный лес";"Бесплатная";"881468519";
"65";"Вербейник монетчатый";"Lisimachia nummularia";"da7062da-50c3-4c11-bccb-d1a615ea5fba";"Смешанный лес";"Май - август";"Вербейник монетчатый известен также как полевой чай. В старину его листья, содержащие достаточно много витамина С, заваривали и пили. Вербейник монетчатый - европейский абориген, но сейчас его можно встретить в умеренной зоне Северной Америки как заносное растение. Растёт преимущественно на лугах, по опушкам и в светлых лесах. Этот вид имеет узнаваемую внешность: его побеги стелются по земле, иногда поднимаются вверх по основанию стволов деревьев. Округлые листья, размером с пятирублёвую монету, растут парами друг напротив друга. В начале лета из пазух листьев выходят жёлтые цветки.";"Смешанный лес";"Бесплатная";"881468521";
"66";"Бор развесистый";"Millium effusum";"8dcd3579-3ccd-427d-a0f7-6a99a7937b36";"Смешанный лес";"Май - июль";"Широкие и сочные листья бора развесистого охотно поедаются скотом, а из его семян в голодные годы делали муку и выпекали хлеб. Ареал бора развесистого охватывает всю Европу и тянется к Гималаям через юг Сибири. Различать злаки - задача не из простых, но у бора развесистого есть один необычный характерный признак. Листья на его цветоносе, свисая, перекручиваются на пол-оборота. Кроме того, у бора развесистого довольно крупное для злаков России соцветие. Растёт этот двоюродный брат ячменя и пшеницы во влажных тенистых лесах. В России его можно встретить, например, в ельниках.";"Смешанный лес";"Бесплатная";"881468524";
"67";"Купена многоцветковая";"Polygonatum multiflorum";"87b74333-291f-4c04-bc86-cd258e4bb918";"Смешанный лес";"Май";"Контуры венчика купены многоцветковой напоминают шестиконечную звезду, из-за чего растение иногда называют «соломонова печать». Ареал купены многоцветковой начинается от атлантического побережья Европы и через Европейскую часть России тянется на юго-восток вплоть до горного Непала. У нас это растение можно встретить в березняках или хвойных лесах, а также среди зарослей кустарников. Высотой до полуметра, побеги купены многоцветковой дугообразно изгибаются, а ланцетовидные листья с заострённым кончиком расположены в два ряда. В мае в пазухах листьев появляются цветоносы со свисающими вниз по 2-3 штуки белыми вытянутыми цветками.";"Смешанный лес";"Бесплатная";"881468529";
"68";"Герань лесная";"Geranium sylvaticum";"a6da38c0-2553-4e53-aee7-ed103ba3ef8a";"Смешанный лес";"Июнь - июль";"Герань лесная - удачное растение для создания композиции тенистого леса. Кроме того, селекционеры вывели на её основе множество сортов, которые и цветут дольше, и отличаются от дикого родственника махровыми цветками. Ареал герани лесной охватывает всю Европу, включая Европейскую часть России, и немного переваливает за Урал, в Южную Сибирь. Это растение можно встретить в лесах на богатых и влажных почвах. Отличить этот вид от ближайшего родственника, герани луговой, можно по менее рассечённым листьям или по торчащим цветоносам (у луговой они поникают). Цветки, как у многих гераней, синеватого цвета.";"Смешанный лес";"Бесплатная";"881468532";
"69";"Герань кроваво-красная";"Geranium sanguineum";"8aea68ed-af31-4799-8a0f-9d5f31bfc1b8";"Смешанный лес";"Июнь - август";"Герань кроваво-красную культивируют в Европе с начала XVI века. С тех пор путём селекции вывели несколько десятков её сортов. Герань кроваво-красная встречается в сухих и светлых лесах, по опушкам, полянам и лугам по всей Европе, заходя в Переднюю Азию. В России она встречается в средней полосе, а также в Крыму и на Кавказе. От родственников этот вид отличается лучше всего по крупным красновато-фиолетовым цветкам с широкими лепестками, накладывающимися друг на друга.";"Смешанный лес";"Бесплатная";"881468534";
